Global Rank,Company,Sales ($billion),Profits ($billion),Assets ($billion),Market Value ($billion),Country,Continent,Latitude,Longitude,Snippet,naics code,input tokens,output tokens
1485,China National Chemical,6.9,0.4,7.2,6.7,China,Asia,35.86166,104.195397,"China National Chemical Corporation, commonly known as ChemChina, is a Chinese state-owned chemical company in the product segments of agrochemicals, ...",3253,104,2
1486,Huntsman,11.2,0.3,8.9,4.6,USA,North America,37.09024,-95.712891,Huntsman Corporation is a publicly traded global chemical manufacturer of differentiated and specialty chemicals serving a diverse range of consumer and ...,3252,99,2
1487,Crown Ltd,2.8,0.5,5.9,9.4,Australia,Oceania,-25.274398,133.775136,"Contact us to build your beautiful new custom home in the Omaha and surrounding area. Visit our 2 story model 3503 S 215th St, Elkhorn, ...",2361,112,2
1487,Mondi,7.7,0.3,8.7,6.4,UK,Europe,55.378051,-3.435973,Mondi is a leader in sustainable packaging and paper providing a breadth of expertise and track record of innovation that means we can help customers to ...,3222,103,2
1489,Bunzl,8.7,0.3,4.8,6.5,UK,Europe,55.378051,-3.435973,"Bunzl is the largest value-added distributor in the world in its market sectors with operations across the Americas, Europe, Asia Pacific and UK & Ireland.",4244,105,2
1489,Concho Resources,1.8,0.4,8.6,10.1,USA,North America,37.09024,-95.712891,"Oct 19, 2020 ... Download .PDF ConocoPhillips and Concho Resources Combination Built Upon Shared Vision to Deliver Superior Returns Through Price Cycles ...",2111,109,2
1491,SK Networks,24.8,0.0,10.0,1.7,South Korea,Asia,35.907757,127.766922,"We network customer value into new experience, social problems with creative solutions, digital technology for business innovation.",5416,94,2
1492,Newell Rubbermaid,5.9,0.4,6.2,7.3,USA,North America,37.09024,-95.712891,Newell is a company that you can grow with and gain experience in numerous types of positions until you find one that works best for you. I also love that ...,3399,110,2
1493,Reliance Steel,8.4,0.4,5.9,5.3,USA,North America,37.09024,-95.712891,Reliance Steel & Aluminum Co. is a leading diversified metal solutions provider.,3314,90,2
1494,Kingdom Holding,0.8,0.2,11.2,19.0,Saudi Arabia,Asia,23.885942,45.079162,The Kingdom Holding Company is a Saudi conglomerate holding company based in Riyadh. The Kingdom Holding Company is a publicly listed company on the Tadawul.,5510,106,2
1495,Hutchinson Port Holdings,1.6,0.3,17.4,7.3,Singapore,Asia,1.352083,103.819836,"Hutchison Port Holdings Trust (""HPH Trust"") is the world's first publicly traded container port business trust. Listed on the Singapore Exchange (""SGX"") in ...",4883,110,2
1496,Petronas Dagangan,9.6,0.3,3.2,7.4,Malaysia,Asia,4.210484,101.975766,"As Malaysia's leading retailer and marketer of downstream petroleum products, we are fuelled with dynamism and positivity as we continue to offer winning ...",3241,106,2
1497,Jindal Steel & Power,3.6,0.8,8.8,6.2,India,Asia,20.593684,78.96288,"Jindal Steel & Power (JSP) is an Indian industrial powerhouse with a dominant presence in the steel, mining, and infrastructure sectors.",3311,107,2
1498,G4S,11.9,0.1,9.1,6.4,UK,Europe,55.378051,-3.435973,"G4S is the world's leading integrated security company, providing security solutions to governments, businesses, and individuals in over 90 countries.",5616,102,2
1499,Perrigo,3.3,0.4,4.3,10.9,USA,North America,37.09024,-95.712891,"Since 1887, Perrigo has been providing its customers and consumers with high-quality products that support personal health and wellness by delivering effective ...",3254,104,2
1500,Unicharm,5.2,0.3,5.2,10.6,Japan,Asia,36.204824,138.252924,"Medium- to long-term ESG goals. Unicharm's sustainability information, environmental, human rights and other initiatives.",3251,98,2
1500,Nvidia,4.3,0.6,6.4,7.8,USA,North America,37.09024,-95.712891,NVIDIA Combines Digital Twins With Real-Time AI for Industrial Automation. Train AI agents to optimize synchronization between robots and humans within their ...,5415,101,2
1500,Xilinx,2.2,0.5,4.6,10.1,USA,North America,37.09024,-95.712891,"AMD delivers leadership high-performance and adaptive computing solutions to advance data center AI, AI PCs, intelligent edge devices, gaming, & beyond.",3344,101,2
1503,Chang Hwa Bank,1.2,0.3,52.3,4.3,Taiwan,Asia,23.69781,120.960515,銀行公告 ... 親愛的客戶您好， 近期有不法分子使用偽冒之行員識別證冒稱本行行員進行誆騙，請客戶務必留意，若有相關疑問請致電本行客服專線(412-2222/0800-365-889)或往來分行 ...,5221,161,2
1504,Accor,7.3,-0.8,10.0,8.4,France,Europe,46.227638,2.213749,"Discover the ultimate hotel experience with ALL - Accor Live Limitless. Explore our global portfolio of exceptional hotels and resorts, enjoy exclusive ...",7211,102,2
1505,Alpha Bank,4.6,-1.4,76.9,0.5,Greece,Europe,39.074208,21.824312,Η Alpha Bank ιδρύθηκε to 1879 και είναι ένας από τους μεγαλύτερους Ομίλους του χρηματοοικονομικού τομέα στην Ελλάδα.,5221,107,2
1506,New Hope Liuhe,11.4,0.4,3.5,3.6,China,Asia,35.86166,104.195397,"New Hope In Global. From fodder production to livestock and poultry breeding, from food processing to terminal catering, everything that is done is for a better ...",1121,108,2
1506,Taiwan Cooperative Financial,1.9,0.2,91.0,4.5,Taiwan,Asia,23.69781,120.960515,"Taiwan Cooperative Financial Holding Co., Ltd. (TCFHC) was established on 1st Dec. 2011. ... TCFHC is a financial group with a broad range of financial products ...",5221,118,2
1508,Samsung Card,3.3,0.7,15.3,4.1,South Korea,Asia,35.907757,127.766922,"With the rewards of a credit card and convenience of a debit card, Samsung Money helps build your money's worth. Keep track of your financial accounts with ...",5223,106,2
1509,X5 Retail Group,15.8,-0.1,9.6,5.0,Russia,Europe,61.52401,105.318756,Press Centre · Other news · X5 Group combines advertising and analytical services for partners under X5 Media brand · Share distribution · PJSC X5 Corporate ...,5418,108,2
1510,Ametek,3.3,0.5,5.2,10.4,USA,North America,37.09024,-95.712891,"As a leading global provider of differentiated electronic instruments and electromechanical devices, we are proud to solve some of the world's most complex ...",3344,103,2
1510,CBRE Group,6.5,0.3,7.8,8.2,USA,North America,37.09024,-95.712891,"We are the global leader in commercial real estate services and investments. With services, insights and data that span every dimension of the industry.",5313,102,2
1512,Smurfit Kappa Group,9.7,0.3,10.9,3.7,Ireland,Europe,53.41291,-8.24389,"Smurfit Kappa is a FTSE 100 company and one of the leading providers of paper-based packaging in the world, with operations in over 30 countries.",3211,112,2
1513,BBMG,5.1,0.5,13.3,4.4,China,Asia,35.86166,104.195397,Sustainability and social impact consulting and branding in NYC and beyond. We work with leaders who won't wait on things that can't.,5416,98,2
1514,Bank Audi,2.0,0.4,31.3,2.4,Lebanon,Asia,33.854721,35.862285,Bank Audi S.A.L. is Lebanon's largest bank in terms of both customer deposits and total assets. Bank Audi currently operates 84 branches in Lebanon and a ...,5221,108,2
1515,Flowserve,4.8,0.4,4.8,8.1,USA,North America,37.09024,-95.712891,"Flowserve moves, controls and protects the flow of materials in the world's most critical industries. Contact a representative today to learn more.",3339,100,2
1516,Orkla,5.4,0.3,10.4,8.4,Norway,Europe,60.472024,8.468946,"Orkla ASA is a leading industrial investment company. Its scope of activity is brands and consumer-oriented companies. At present, Orkla has 11 portfolio ...",3113,106,2
1517,Embraer,6.2,0.3,9.5,6.3,Brazil,South America,-14.235004,-51.92528,Embraer celebrates 55 years with focus on growth and confidence in the future · Embraer celebrates 55 years with focus on growth and confidence in the future.,3364,109,2
1517,EasyJet,6.2,0.4,6.9,6.4,UK,Europe,55.378051,-3.435973,"We've got you covered. We can connect you further across the globe with quick, easy transfers through our European hubs.",4811,97,2
1519,Huatai Securities,1.3,0.3,13.6,9.5,China,Asia,35.86166,104.195397,We provide experienced investment banking and institutional securities services backed by our parent company's vast resource network in China.,5231,95,2
1520,BR Malls,0.6,0.9,8.7,5.8,Brazil,South America,-14.235004,-51.92528,"BRMalls, styled as brMalls, is a Brazilian company that operates in the business of shopping center management, with participation in 31 shoppings in all ...",5311,110,2
1521,Hexagon,3.2,0.5,7.0,9.8,Sweden,Europe,60.128161,18.643501,"Hexagon technology captures data about physical reality, makes it digitally immersive, and helps you put it to work in multiple industries.",5415,99,2
1522,Lundbergs,3.3,0.5,13.9,5.2,Sweden,Europe,60.128161,18.643501,"Elizabeth A. ""Liz"" (Pagel) Foss, age 81, a longtime Kenyon resident, died peacefully on Saturday morning, August 31, 2024 at Cannon Rivers ...",6211,115,2
1523,Compal Electronics,23.1,0.2,9.8,3.0,Taiwan,Asia,23.69781,120.960515,"Excellence in Manufacturing · Skilled Engineering · Cutting Edge Concept Development · Experienced Design Creation. We don't just create prototypes, we design ...",3341,101,2
1524,Neste Oil,23.7,0.2,9.7,3.8,Finland,Europe,61.92411,25.748151,"Neste offers refined high-quality, low-sulphur bunker fuels which guarantee uncompromising stability. Making waves. In the marine transport sector, even ...",3241,106,2
1526,Travis Perkins,7.9,0.4,7.1,5.0,UK,Europe,55.378051,-3.435973,"Buy building supplies from UK's largest builders' merchant, Travis Perkins. Track your branch delivery or click & collect. Open an account for trade prices.",4923,104,2
1527,Masraf Al Rayan,0.7,0.4,16.9,5.1,Qatar,Asia,25.354826,51.183884,"Welcome to Masraf Al Rayan, your leading Shari'a-compliant banking partner. Our products at a glance: Accounts, Current Saving & Investment, Al Thahabi Term ...",5221,115,2
1528,Xiamen C&D,12.8,0.4,8.2,2.3,China,Asia,35.86166,104.195397,"Xiamen C&D Inc. (stock code: 600153.SH), a core member of Xiamen C&D Corp., Ltd., a Fortune Global 500, is a modern service-oriented enterprise that ...",5611,121,2
1529,China International Marine,8.6,0.3,10.3,4.9,China,Asia,35.86166,104.195397,"CIMC Enric Win Bid for the Largest Green Hydrogen-Ammonia-Methanol Integration Project in China ... © 2023 China International Marine Containers (Group) Co., Ltd.",3251,112,2
1530,Public Power,7.7,0.0,21.2,2.0,Greece,Europe,39.074208,21.824312,"The American Public Power Association is the voice of not-for-profit, community-owned utilities that power 2000 towns and cities nationwide.",2211,100,2
1531,Aker Solutions,8.1,0.4,7.1,5.1,Norway,Europe,60.472024,8.468946,"Aker Solutions delivers integrated solutions, products and services to the global energy industry. We enable low-carbon oil and gas production and develop ...",2131,103,2
1532,Crescent Point Energy,2.0,0.2,12.2,14.4,Canada,North America,56.130366,-106.346771,"We've transformed our organization through a revised business strategy, revamped portfolio of top-tier assets and a renewed commitment to our purpose statement.",2111,102,2
1533,BS Financial Group,2.1,0.3,38.6,2.8,South Korea,Asia,35.907757,127.766922,"This degree program supplies groundwork in financial education and business administration, with an emphasis on banking. Subjects covered range from money, ...",5221,101,2
1534,China Merchants Securities,1.1,0.3,10.9,9.7,China,Asia,35.86166,104.195397,"We are one of the few all-rounded securities firms providing comprehensive professional corporate financing and capital markets services for Hong Kong, the PRC ...",5231,104,2
1534,Sino Land,1.1,0.6,14.7,3.9,Hong Kong,Asia,22.396428,114.109497,"Sino Group is a leading property developer in Hong Kong. We develop residential properties, offices, industrial and retail properties for sale and ...",2361,102,2
1534,HCL Technologies,3.8,0.4,3.2,10.2,India,Asia,20.593684,78.96288,"HCLTech - Global technology company, home to 219000 people across 60 countries, supercharging progress for the world's top enterprises by bringing together ...",5415,107,2
1537,Citrix Systems,2.6,0.4,4.8,8.1,USA,North America,37.09024,-95.712891,"Discover the new Citrix platform, revolutionizing application delivery with enhanced security, Zero Trust frameworks, and unmatched performance.",5112,98,2
1538,FinanciÃ¨re de l'Odet,11.0,0.3,11.1,3.2,France,Europe,46.227638,2.213749,"Compagnie De l'odet SE (ODET:PAR) company profile with history, revenue ... Financi re Tiepolo SASas of 29 Dec 2023, 2.40k, 0.04%. HC Capital Advisors GmbH ...",5511,136,2
1539,PostNL,5.7,0.9,6.1,1.0,The Netherlands,Europe,52.132633,5.291266,"PostNL delivers a world of opportunities. See what our domestic and international mail, parcel and logistic solutions can do for your business.",4911,100,2
1540,InterContinental Hotels,1.9,0.6,3.1,8.1,UK,Europe,55.378051,-3.435973,"Desirable Addresses With All The Comforts Of Home. An international beacon of hospitality for the worldly, InterContinental Residences are for those who believe ...",7211,108,2
1541,Avis Budget Group,7.4,0.3,15.2,3.0,USA,North America,37.09024,-95.712891,"Who We Are. We are a provider of global transportation solutions through three of the most recognized brands in the industry: Avis, Budget, and Zipcar.",5321,106,2
1542,Natura Cosmeticos,3.1,0.4,2.5,10.5,Brazil,South America,-14.235004,-51.92528,"We combine sustainably sourced ingredients from the Amazon and advanced science to offer 100% vegan and cruelty-free bath & body, hair and skincare products ...",3254,107,2
1543,CGI Group,6.3,0.0,10.8,8.0,Canada,North America,56.130366,-106.346771,"Founded in 1976, CGI is among the largest IT and business consulting services firms in the world. We are insights-driven and outcomes-based to help accelerate ...",5415,108,2
1544,Hunan Valin Steel,11.7,0.0,13.6,1.0,China,Asia,35.86166,104.195397,"It is primarily engaged in the smelting, manufacture and sale of iron and steel products, as well as nonferrous metal products.",3312,104,2
1545,Sigma-Aldrich,2.6,0.5,3.8,9.5,USA,North America,37.09024,-95.712891,"We impact life and health with science by offering one of the broadest portfolios of best-in-class products and services for scientists, ...",3254,103,2
1546,Saudi Arabian Mining,1.5,0.3,14.7,8.1,Saudi Arabia,Asia,23.885942,45.079162,"Ma'aden pioneered the mining industry in Saudi Arabia, building a world ... Ma'aden is becoming a key player in the long-term diversification of Saudi Arabia ...",2122,108,2
1547,NSK,8.9,0.3,10.2,4.2,Japan,Asia,36.204824,138.252924,"Global leader in Motion & Control. NSK keeps the world moving with bearings, ball screws, linear guides, auto parts, and precision machinery solutions.",3363,103,2
1548,CR Bard,3.0,0.5,4.2,8.3,USA,North America,37.09024,-95.712891,"At BD, we seek to usher in a new era of healthcare by bringing medical products, capabilities and solutions to every corner of the world.",3391,102,2
1549,Experditors International,6.0,0.3,3.0,7.9,USA,North America,37.09024,-95.712891,"Expeditors is a global logistics company headquartered in Bellevue, Washington. The company employs trained professionals seamless worldwide network through ...",4885,101,2
1550,Union National Bank,1.2,0.4,23.7,2.7,United Arab Emirates,Asia,23.424076,53.847818,"Business Banking made powerfully Simple. Since 1904, UNB has specialized in servicing privately-held businesses. That hasn't changed. It just gets better.",5221,106,2
1551,Kinross Gold,4.3,-2.5,14.9,9.1,Canada,North America,56.130366,-106.346771,"Sep 10, 2023 ... Creating value through responsible mining. Learn about how Kinross is making a positive contribution in the host communities and countries where we operate.",2122,109,2
1551,Weir Group,4.1,0.5,5.3,7.9,UK,Europe,55.378051,-3.435973,The Weir Group creates innovative engineering solutions for minerals and mining technology markets. Ask us about our wide range of products.,3331,99,2
1553,China Communications Services,9.8,0.4,7.2,4.7,China,Asia,35.86166,104.195397,"Positioning as a ""New Generation Integrated Smart Service Provider"" and striving to provide relevant smart solutions for various industry applications in the ...",5173,102,2
1554,ICAP,2.7,0.2,129.9,3.2,UK,Europe,55.378051,-3.435973,"Connecting clients to a world of liquidity. ICAP is a world-leading intermediary in wholesale financial, energy, and commodities markets.",5231,99,2
1555,Wistron,22.2,0.2,9.4,2.5,Taiwan,Asia,23.69781,120.960515,Wistron Corporation is a technology service provider supplying innovative.,5415,87,2
1556,Banca Popolare dell'Emilia,4.1,0.0,81.3,2.6,Italy,Europe,41.87194,12.56738,"Finanzia i tuoi progetti con BPER Banca: tante soluzioni di finanziamento, prestiti e mutui per realizzare i tuoi sogni.",5221,112,2
1556,Hokuhoku Financial Group,2.5,0.2,128.7,2.6,Japan,Asia,36.204824,138.252924,About Hokuhoku FG · Message from President · Corporate Data · Management Philosophy · Management Strategy · Subsidiaries and an Affiliate · Financial ...,5221,107,2
1559,Beam,2.5,0.4,8.6,10.1,USA,North America,37.09024,-95.712891,"Dental, vision, life, disability, and supplemental health. Our plans are easy to understand, easy to implement, and even easier to use.",5241,102,2
1560,Hokkaido Electric Power,7.7,-0.9,19.6,1.7,Japan,Asia,36.204824,138.252924,"Welcome to the website of the Hokkaido Electric Power Company (HEPCO), Japan. Please view our corporate information and activities.",2211,104,2
1561,LagardÃ¨re,9.5,0.1,12.4,5.0,France,Europe,46.227638,2.213749,"Jun 11, 2024 ... We're not declaring victory over inflation yet. Our destination is 2% and we know there will be bumps on the road there.",5111,111,2
1561,Kansas City Southern,2.2,0.4,6.4,11.9,USA,North America,37.09024,-95.712891,Kansas City Southern is the cross-border freight railroad at the heart of every transportation supply chain in the United States and Mexico.,4821,99,2
1563,Pall,2.7,0.6,3.5,7.6,USA,North America,37.09024,-95.712891,"Since 1946, we have pushed the limits of science and technology to solve the most complex filtration, separation and purification challenges.",3334,100,2
1564,Chinese Estates,0.4,1.3,9.6,2.9,Hong Kong,Asia,22.396428,114.109497,Chinese Estates is one of the leading property companies in Hong Kong. The Group comprises of three companies publicly listed on the Hong Kong Stock ...,5311,102,2
1565,Pinnacle West,3.3,0.4,13.4,6.3,USA,North America,37.09024,-95.712891,"New customer rates, record heat positively impact quarter-over-quarter earnings Customer and sales growth continue to reflect a strong Arizona economy Expanded ...",2211,102,2
1566,BOK Financial,1.5,0.4,28.1,4.2,USA,North America,37.09024,-95.712891,"Learn about our competitive banking services, credit solutions, financial planning and investment services for individuals, small businesses and ...",5222,98,2
1567,Yamaguchi Financial,1.8,0.2,110.2,2.5,Japan,Asia,36.204824,138.252924,"Get Yamaguchi Financial Group Inc (8418.T) real-time stock quotes, news, price and financial information from Reuters to inform your trading and ...",5231,108,2
1568,Dongfang Electric,6.0,0.3,12.6,4.7,China,Asia,35.86166,104.195397,Error,3353,77,2
1569,Coloplast,1.9,0.4,1.8,11.4,Denmark,Europe,56.26392,9.501785,"Coloplast develops ostomy, continence, urology, wound and skin care products and services that make life easier for people with intimate healthcare needs.",3391,104,2
1570,World Fuel Services,38.9,0.2,4.1,2.9,USA,North America,37.09024,-95.712891,... ). There was a problem loading the transcript. Refresh. Play. Our Solutions. Land Fuels · Energy Services · Sustainability. Aviation. Aviation. learn more ...,4861,109,2
1571,Burberry Group,3.0,0.4,2.4,9.7,UK,Europe,55.378051,-3.435973,"Founded in 1856, our brand is underpinned by our founder's passion for the outdoors. Thomas Burberry invented the innovative rain-ready fabric gabardine.",3152,109,2
1572,Salzgitter,13.4,-0.1,11.7,2.5,Germany,Europe,51.165691,10.451526,"an independent city in southeast Lower Saxony, Germany, located between Hildesheim and Braunschweig.",3311,97,2
1572,Scripps Network Interactive,2.3,0.4,4.1,9.6,USA,North America,37.09024,-95.712891,Scripps Networks expansive portfolio of national news outlets and leading entertainment brands reach nearly every American household.,5151,97,2
1574,Banrisul,3.6,0.4,22.3,3.6,Brazil,South America,-14.235004,-51.92528,Nossa Conexão Transforma! Quer acessar o app? O acesso deve ser feito direto pelo Aplicativo Banrisul. Se você ainda não tiver baixado ...,5221,109,2
1576,Arkema,8.4,0.3,7.2,6.4,France,Europe,46.227638,2.213749,Arkema is a global leader in Specialty Materials serving major societal and ecological challenges.,3254,90,2
1577,Shangri-La Asia,2.1,0.4,11.9,7.2,Hong Kong,Asia,22.396428,114.109497,"Corporate Profile. As an owner-developer-operator, Shangri-La Asia Limited has a diverse asset portfolio comprising hotels, offices, retail spaces, residential ...",7211,109,2
1578,Ingredion,6.5,0.4,5.6,5.3,USA,North America,37.09024,-95.712891,"Formulate for amazing taste AND better nutrition AND enhanced sustainability. Ingredion is your ideal partner in developing the future of food, empowering you ...",3113,103,2
1580,UNY Group Holdings,13.3,0.1,11.7,1.7,Japan,Asia,36.204824,138.252924,"UNY Co., Ltd is a company that operates a chain of supermarkets in Japan. Most of the stores are mainly located in the Chūbu and Kantō regions, ...",4451,112,2
1581,Indian Bank,2.6,0.3,27.5,1.4,India,Asia,20.593684,78.96288,Indian Bank established on 15th August 1907 as part of the Swadeshi movement. ISS certified Standard ISO27001:2013 very few Banks certified worldwide.,5221,109,2
1581,Joyo Bank,1.9,0.2,97.1,4.2,Japan,Asia,36.204824,138.252924,"Information regarding Business Integration with Ashikaga Holdings Co., Ltd. Websites of institutions with which the Bank has a close relationship.",5221,100,2
1581,Enagas,1.6,0.5,10.6,5.8,Spain,Europe,40.463667,-3.74922,"Enagás is an international leader in the development, maintenance and operation of energy infrastructure. For further information visit our website!",4862,99,2
1584,Teradata,2.7,0.4,3.1,9.6,USA,North America,37.09024,-95.712891,The most complete cloud analytics and data platform for AI. Deliver harmonized data and faster innovation.,5415,93,2
1585,Nishi-Nippon City Bank,1.9,0.2,92.7,2.4,Japan,Asia,36.204824,138.252924,"... 機関 福岡財務支局長（登金）第6号 加入協会 日本証券業協会 一般社団法人金融先物取引業協会. © THE NISHI-NIPPON CITY BANK, LTD. All right reserved. Page Top.",5221,142,2
1586,Marfrig Group,12.3,-0.1,12.0,2.5,Brazil,South America,-14.235004,-51.92528,Error,3116,77,2
1586,Hyosung,11.2,0.1,12.9,1.6,South Korea,Asia,35.907757,127.766922,"Hyosung Innovue is the leading ATM, cash machine, and kiosk manufacturing company that is continuously innovating self-service cash management technology ...",3320,104,2
1588,77 Bank,1.4,0.1,92.2,2.0,Japan,Asia,36.204824,138.252924,"Jan 30, 2024 ... to Stockholders & Investors ... The purpose of this web site is to provide information of The 77 Bank is not to induce viewers to conduct any sale ...",5221,114,2
1588,Wolters Kluwer,4.8,0.4,8.5,6.6,The Netherlands,Europe,52.132633,5.291266,"Wolters Kluwer is a global provider of professional information, software solutions, and services.",5111,97,2
1588,Plains Exploration,2.6,0.3,17.3,6.1,USA,North America,37.09024,-95.712891,"Plains Exploration & Production was a petroleum and natural gas exploration company based in Houston, Texas. In May 2013, it was acquired by ...",2111,105,2
1591,Empresas CMPC,4.8,0.2,14.0,8.0,Chile,South America,-35.675147,-71.542969,"En CMPC estamos comprometidos con esta mirada que nos impulsa a evolucionar como personas, empresa, industria forestal y sociedad, haciéndolo desde nuestros ...",1133,110,2
1592,Goodman Group,0.7,0.4,8.4,8.9,Australia,Oceania,-25.274398,133.775136,"Experience leading-edge innovation and design in communities that are committed to care, camaraderie and well-being.",6233,95,2
1592,Inner Mongolia Yili,6.0,0.3,3.2,8.9,China,Asia,35.86166,104.195397,"Yili is the leading domestic dairy industry, offering an extensive and highly-focused supply of dairy sources, including milk from the 45℃ Golden Milk Source ...",3111,108,2
1594,Grupo Argos,3.8,0.2,15.2,9.5,Colombia,South America,4.570868,-74.297333,En Grupo Argos transformamos positivamente la vida de las personas a través de inversiones y operaciones en los territorios donde estamos presentes.,2373,102,2
1594,CVR Energy,8.6,0.4,3.6,4.8,USA,North America,37.09024,-95.712891,Error,3241,77,2
1596,Magnitogorsk Iron & Steel,8.5,-0.1,16.2,3.3,Russia,Europe,61.52401,105.318756,"MMK is an iron and steel company located in the city of Magnitogorsk, Russia. [3] As of 2017, it was the 30th largest steel company in the world.",3311,121,2
1597,TDK,9.8,0.0,12.6,4.6,Japan,Asia,36.204824,138.252924,Welcome to TDK corporate website. TDK is the world's leading electronic components and devices company that has the high magnetics technology.,3344,100,2
1598,Bank of Kyoto,1.4,0.2,89.4,3.5,Japan,Asia,36.204824,138.252924,"Bank of Kyoto ... The Bank of Kyoto established its parent company, Kyoto Financial Group, in October 2023. Please use the Kyoto Financial Group website for ...",5221,108,2
1599,Helmerich & Payne,3.3,0.6,5.9,7.0,USA,North America,37.09024,-95.712891,"H&P's purpose-driven expertise, best-in-class technology and industry-leading rig designs help customers maximize production and unlock value beyond the…",2131,103,2
