Global Rank,Company,Sales ($billion),Profits ($billion),Assets ($billion),Market Value ($billion),Country,Continent,Latitude,Longitude,Snippet,naics code,input tokens,output tokens
916,Mylan,6.8,0.6,11.9,12.1,USA,North America,37.09024,-95.712891,"Mylan is now part of Viatris, a new global healthcare company committed to empowering people to live healthier at every stage of life. We encourage you to ...",3254,108,2
917,Whole Foods Market,12.2,0.5,5.1,16.1,USA,North America,37.09024,-95.712891,Whole Foods Market | Weekly Sales | Shop In-Store & Online · Save 33% on All Supplements with Prime · Easy meals for the busiest days. · Unlimited grocery ...,4452,111,2
918,Grupo Televisa,5.4,0.7,12.6,14.9,Mexico,North America,23.634501,-102.552784,Televisa is a major telecommunications corporation which owns and operates one of the most significant cable companies as well as a leading direct-to-home ...,5151,103,2
919,American Tower,2.9,0.6,14.1,29.9,USA,North America,37.09024,-95.712891,A Global Provider of Digital Communications Infrastructure. American Tower offers solutions and services to deploy and support wireless networks in 25 countries ...,5173,100,2
920,Canara Bank,6.7,0.7,74.4,3.5,India,Asia,20.593684,78.96288,"Welcome to Canara Bank, an Ideal destination for Personal Banking needs! We offer a wide range of banking services like a savings account, FD, debit card, ...",5211,109,2
922,Bank Negara Indonesia,3.2,0.7,34.6,9.0,Indonesia,Asia,-0.789275,113.921327,"BNI Services · Experience easy and secure transactions on wondr · Make your payments easily. Send money, pay bills, top up e-Wallets, and make QRIS payments ...",5221,113,2
923,Evraz Group,16.4,0.5,17.0,5.4,UK,Europe,55.378051,-3.435973,"EVRAZ is a vertically integrated steel, mining and vanadium business with operations in Russia, the United States, Canada, the Czech Republic, Italy and ...",3312,108,2
924,Investec,5.8,0.4,82.1,6.5,UK,Europe,55.378051,-3.435973,"A leading international banking group. Investec partners with companies and institutions in North America, with expertise in equity sales and corporate access, ...",5231,102,2
925,Industrias PeÃ±oles,7.4,0.8,6.4,17.4,Mexico,North America,23.634501,-102.552784,"Industrias Peñoles, el grupo minero-metalúrgico que contribuye al desarrollo económico y social de México. Entra y conócenos.",2122,111,2
926,Banque Saudi Fransi,1.6,0.8,42.1,7.4,Saudi Arabia,Asia,23.885942,45.079162,All your banking needs in one place. All products & services Corporate Banking Group We at BSF offer comprehensive solutions that satisfy your financial needs.,5221,105,2
926,Campbell Soup,8.1,0.7,8.6,13.1,USA,North America,37.09024,-95.712891,"Connecting people through food they love. Over 150 years of making delicious, well-crafted soups, simple meals, snacks, and beverages for all.",3112,104,2
928,Espirito Santo Financial,8.7,0.4,114.5,1.4,Luxembourg,Europe,49.815273,6.129583,"Espírito Santo Financial Group ... The Espírito Santo Financial Group (ESFG) was a Portuguese holding company with headquarters in Luxembourg, founded in 1984.",5511,107,2
929,Marriott International,11.8,0.6,6.3,12.6,USA,North America,37.09024,-95.712891,"Book Directly & Save at any of our 8000+ Marriott Bonvoy Hotels. Choose from Luxury Hotels, Resorts, Extended Stay Hotels, Pet-Friendly Hotels & More.",7211,110,2
930,Beirsdorf,8.0,0.6,7.2,20.8,Germany,Europe,51.165691,10.451526,"Pioneering work in research & development and still a success: 25 years ago, Beiersdorf launched the first NIVEA skin care products with Q10 on the mass market ...",3256,114,2
932,Secom,8.2,0.4,13.2,11.6,Japan,Asia,36.204824,138.252924,Our Services · Healthy Food Pantry & ​Farm-Fresh Market · ​ Education · Volunteering & Groups · Community Garden​​ · Interested in learning more about SECOM?,6242,108,2
933,Daiwa Securities,5.1,-0.5,229.9,12.0,Japan,Asia,36.204824,138.252924,The official site of the Daiwa Securities Group. The Daiwa Securities Group is a comprehensive securities group that provides a wide range of services ...,5231,105,2
934,Kweichow Moutal,3.8,2.1,6.2,29.6,China,Asia,35.86166,104.195397,"Kweichow Moutai, the world's most mysterious spirit is waiting for you to be discovered and tasted. Are you ready to discover Kweichow Moutai?",3121,112,2
935,EletrobrÃ¡s,17.5,-3.5,84.1,5.0,Brazil,South America,-14.235004,-51.92528,Error,2211,81,2
936,AngloGold Ashanti,6.1,0.8,12.6,9.5,South Africa,Africa,-30.559482,22.937506,"AngloGold Ashanti is global mining company with a diverse, high-quality portfolio of gold, silver, copper operations and projects.",2122,102,2
937,Formosa Chemicals,13.2,0.2,16.0,14.1,Taiwan,Asia,23.69781,120.960515,We will provide you with the most suitable products. Choose origin Taiwan China 越南 Choose application IT Office Equipment Home Appliance Toys & Sports ...,3261,104,2
938,Antarchile,22.8,0.2,22.3,7.5,Chile,South America,-35.675147,-71.542969,"AntarChile S.A. es una sociedad anónima chilena ligada a la familia Angelini, controladora de la compañía forestal Celulosa Arauco y Constitución, ...",3211,113,2
939,Rexel,17.7,0.4,13.4,6.4,France,Europe,46.227638,2.213749,"Buy Electrical Supplies Online at Rexel USA. Wholesale electrical, industrial, lighting, tools, control and automation products.",4236,98,2
940,Jeronimo Martins,14.0,0.5,5.9,12.8,Portugal,Europe,39.399872,-8.224454,Jerónimo Martins is a Portugal-based international Group operating in the Food Distribution and Specialised Retail sectors.,4451,96,2
941,Petronas Chemicals,5.4,1.2,8.3,16.3,Malaysia,Asia,4.210484,101.975766,"We are Malaysia's leading integrated chemicals producer. Our operations include manufacturing, marketing and selling a variety of petrochemicals.",3251,100,2
942,Inveco,4.2,0.7,17.5,12.8,Bermuda,North America,32.321384,-64.75737,"Company profile page for Inveco International Inc including stock price, company news, executives, board members, and contact information.",5173,100,2
943,Electrolux Group,16.9,0.4,11.2,8.1,Sweden,Europe,60.128161,18.643501,Electrolux Group is a leading global appliance company that has shaped living for the better for more than 100 years.,3352,100,2
944,PartnerRe,5.6,1.1,23.0,5.4,Bermuda,North America,32.321384,-64.75737,"We are a leading global reinsurer that helps insurance companies reduce their earnings volatility, strengthen their capital and grow their businesses ...",5241,99,2
944,Banco de Sabadell,8.5,0.1,213.0,6.6,Spain,Europe,40.463667,-3.74922,"La cuenta online sin condiciones, sin comisiones · Cuenta remunerada para tu día a día, exclusiva para nuevos clientes. · Te devolvemos el 3% de tus recibos ...",5221,115,2
944,Best Buy,49.6,-0.2,16.8,7.2,USA,North America,37.09024,-95.712891,"Shop Best Buy for electronics, computers, appliances, cell phones, video games & more new tech. In-store pickup & free 2-day shipping on thousands of items.",4431,108,2
948,Everest Re Group,4.9,0.8,19.8,7.8,Bermuda,North America,32.321384,-64.75737,"Everest is a global underwriting leader providing best-in-class property, casualty and specialty reinsurance and insurance solutions.",5241,97,2
948,Onex,27.4,-0.1,36.3,5.3,Canada,North America,56.130366,-106.346771,"Founded in 1984, we manage and invest capital on behalf of our shareholders and institutional investors. We offer access to differentiated investment ...",5231,102,2
948,Daiichi Sankyo,11.3,0.1,17.9,13.9,Japan,Asia,36.204824,138.252924,"Passion for Innovation. Compassion for Patients. Our Stories When Sankyo Sold Harley-Davidson Motorcycles Daiichi Sankyo Predecessor Company, Sankyo C...",3254,109,2
951,SK Hynix,9.6,-0.1,17.1,18.0,South Korea,Asia,35.907757,127.766922,"News · SK hynix Becomes First Semiconductor Company in Korea to Receive 'IECQ QC 080000' Certification · SK hynix Becomes Founding Member of SCC, Joining ...",3344,114,2
952,Insurance Australia Group,9.2,0.2,25.4,12.4,Australia,Oceania,-25.274398,133.775136,Search form · We make your world a safer place · That's our purpose · Latest News · Latest News · Latest News · Spotlight · IAG. About us · Shareholder centre ...,5241,112,2
952,Sinopharm Group,21.5,0.3,12.8,8.0,China,Asia,35.86166,104.195397,"Sinopharm Group Co. Ltd. (the “Company”, “Sinopharm” or “Sinopharm Group”, together with its subsidiaries referred to as the “Group”), which was established in ...",4242,118,2
954,Chow Tai Fook Holdings,7.3,0.8,6.1,13.8,Hong Kong,Asia,22.396428,114.109497,"Chow Tai Fook Capital is owned by the descendants of the late Chow Tai Fook Jewellery founder Chow Chi-yuen (Chinese: 周至元) and his son-in-law, the late Cheng ...",4483,119,2
955,Weyerhaeuser,7.1,0.4,12.6,16.6,USA,North America,37.09024,-95.712891,"Unlocking the potential of working forests through renewable energy development, forest carbon and CCS, conservation and mitigation banking.",1133,99,2
956,CSL,4.5,1.0,5.8,32.0,Australia,Oceania,-25.274398,133.775136,"CSL consists of CSL Behring, CSL Seqirus and CSL Vifor. Together they help ensure people everywhere get the treatments they need.",3254,103,2
957,Banque Nationale de Belgique,2.4,1.2,165.8,1.4,Belgium,Europe,50.503887,4.469936,National Bank of Belgium · Nederlands · Home · Balanscentrale ... La Banque nationale · English · Home · Central Balance Sheet Office · Central Credit ...,5211,108,2
957,Great Wall Motor,6.6,0.9,6.8,14.3,China,Asia,35.86166,104.195397,GLOBAL SITE. ABOUT GWM. GLOBAL GWM · AFTER-SALES SERVICE · COMPLIANCE · SOCIAL RESPONSIBILITY. INNOVATION.,3361,103,2
959,Ryanair Holdings,5.8,0.7,12.0,10.7,Ireland,Europe,53.41291,-8.24389,Book Cheap Flights direct at the official Ryanair website for Europe's lowest fares. Fully allocated seating and much more now available online.,4811,101,2
960,Baidu,3.5,1.7,7.3,29.7,China,Asia,35.86166,104.195397,"The Investor Relations website contains information about Baidu Inc 's business for stockholders, potential investors, and financial analysts.",5191,98,2
961,HermÃ¨s International,4.5,1.0,3.5,34.9,France,Europe,46.227638,2.213749,"Discover all the collections of Hermès, fashion accessories, scarves and ties, belts and ready-to-wear, perfumes, watches and jewelry.",4482,105,2
962,GAIL India,8.7,0.9,10.0,7.6,India,Asia,20.593684,78.96288,We are India's largest Natural Gas Company and one of the seven Maharatna Public Sector Undertakings (PSUs) under Government of India. ... Sustainable development ...,4862,108,2
963,Shizuoka Bank,2.4,0.4,117.8,7.3,Japan,Asia,36.204824,138.252924,Foster regional goals as a growing comprehensive financial group.,5221,86,2
964,Advanced Info Service,4.6,1.1,3.1,23.2,Thailand,Asia,15.870032,100.992541,"We are a trusted partner, empowering individuals, businesses, and communities to thrive in the digital world. Our dedication to delivering best-in-class ...",5173,104,2
965,Longfor Properties,4.4,1.0,16.8,8.6,China,Asia,35.86166,104.195397,"... property development, commercial investment, asset management, property management, and intelligent construction. Longfor has successfully achieved a ...",5311,100,2
966,Steinhoff International,9.9,0.7,16.2,5.0,South Africa,Africa,-30.559482,22.937506,Steinhoff International was a multinational holding company that was dual listed in Germany and South Africa. It was officially liquidated on 13 October 2023.,5511,108,2
967,Dassault Aviation,5.1,0.7,13.7,11.9,France,Europe,46.227638,2.213749,"Dassault Aviation designs, manufactures and supports combat aircraft and business jets. Our brands: Rafale, Falcon, nEUROn.",3361,102,2
968,Coca-Cola Enterprises,8.1,0.7,9.5,10.1,USA,North America,37.09024,-95.712891,"We are here to refresh the world and make a difference. Learn more about the Coca-Cola Company, our brands, and how we strive to do business the right way.",3121,110,2
969,Haitong Securities,1.6,0.5,20.3,16.7,China,Asia,35.86166,104.195397,Haitong Securities is the first Chinese investment bank with a global capability operating across developed and emerging markets. It plays a key role in ...,5231,104,2
970,Ralph Lauren,6.9,0.7,5.5,15.5,USA,North America,37.09024,-95.712891,"Shop Ralph Lauren's designer clothing for men, women, kids & babies, plus accessories and home furnishings. Free Shipping With an RL Account & Free Returns.",4481,106,2
971,Hershey,6.6,0.7,4.8,18.2,USA,North America,37.09024,-95.712891,"Here at Hershey, our purpose is to make more moments of goodness for consumers around the world.",3113,95,2
972,Singapore Airlines,11.8,0.3,17.5,10.0,Singapore,Asia,1.352083,103.819836,Book flight tickets from Singapore to international destinations with Singapore Airlines. Plan your holiday with our latest travel deals and promotions.,4811,97,2
973,Bank of India,6.3,0.5,76.1,3.4,India,Asia,20.593684,78.96288,"Here at Bank of India you can avail many products and services from Personal and Business banking such as cards, loans, mutual funds, insurance and much ...",5221,106,2
973,RHB Capital,2.0,0.6,61.8,6.8,Malaysia,Asia,4.210484,101.975766,"Company profile page for RHB Capital Bhd including stock price, company news, executives, board members, and contact information.",5231,100,2
975,Mitsubishi Motors,21.8,0.3,15.9,6.8,Japan,Asia,36.204824,138.252924,"Enter your email below for the latest news on all things Mitsubishi, including special offers, sales events, and new vehicle launches.",3361,101,2
976,Finatis,54.9,0.2,40.0,0.5,France,Europe,46.227638,2.213749,... générale ordinaire. View all Tout l'agenda. RAPPORT ANNUEL 2023. > TÉLÉCHARGER LE PDF. Le groupe FINATIS. © FINATIS. Contact | Plan du site | Mentions légales.,5511,128,2
977,Lear,14.6,1.3,8.2,5.4,USA,North America,37.09024,-95.712891,"Lear, a global automotive technology leader in Seating and E-Systems, is Making every drive better™ by delivering intelligent in-vehicle experiences for ...",3361,103,2
978,Mechel,11.4,0.7,19.3,2.2,Russia,Europe,61.52401,105.318756,"Mechel ... Mechel (Russian: ПАО «Мечел») is one of Russia's mining and metals companies, comprising producers of coal, iron ore in concentrate, steel, rolled ...",2122,114,2
979,GKN,10.6,0.8,9.7,6.8,UK,Europe,55.378051,-3.435973,"GKN Aerospace is a global technology leader in the aerospace industry, with advanced aerostructures and engine systems on board 100000 flights a day.",3364,105,2
981,Emirates NBD,3.8,0.6,83.9,5.8,United Arab Emirates,Asia,23.424076,53.847818,"Experience tailored banking services with Emirates NBD, one of the UAE's top banks. Enjoy simplicity in banking and zero commissions for 3 months on wealth ...",5221,109,2
982,Eastman Chemical,8.1,0.4,11.6,11.2,USA,North America,37.09024,-95.712891,"© 2024 Eastman Chemical Company or its subsidiaries. All rights reserved. As used herein, ® denotes registered trademark status in the U.S. only. This site ...",3251,111,2
983,Shaw Communications,5.1,0.8,12.5,10.8,Canada,North America,56.130366,-106.346771,"Discover Rogers and Shaw's high speed fibre-powered internet, next-gen WiFi tech, and cable digital TV bundles. Our fastest internet comes with speeds up to ...",5173,108,2
984,Huntington Bancshares,3.0,0.6,56.2,6.3,USA,North America,37.09024,-95.712891,"Huntington provides online banking solutions, mortgage, investing, loans, credit cards, and personal, small business, and commercial financial services.",5221,103,2
985,Steel Authority of India,9.0,0.7,15.4,5.3,India,Asia,20.593684,78.96288,Steel Authority of India Limited - A Maharatna CPSE ... 01 ... One of the largest steel products in india ... 02 ... Indian government company ... 03 ... Maharatna CPSE.,3311,117,2
985,DP World,3.1,0.7,16.4,12.0,United Arab Emirates,Asia,23.424076,53.847818,"DP World exists to make the world's trade flow better, changing what's possible for the customers and communities we serve globally.",4883,97,2
987,Bidvest Group,16.4,0.5,6.8,8.1,South Africa,Africa,-30.559482,22.937506,"We're an international services, trading and distribution company, listed on the JSE, South Africa and operating on four continents.",4234,99,2
987,Comerica,2.7,0.5,65.4,6.9,USA,North America,37.09024,-95.712891,"Comerica Incorporated (NYSE: CMA) is a financial services company headquartered in Dallas, Texas, and strategically aligned by three business segments: The ...",5211,105,2
989,Murata Manufacturing,7.1,0.4,12.0,15.6,Japan,Asia,36.204824,138.252924,"We offer a broad variety of ideas and suggestions to help our customers with product planning, development, and implementation.",3344,97,2
990,Mattel,6.4,0.8,6.5,14.5,USA,North America,37.09024,-95.712891,"We empower the next generation to explore the wonder of childhood and reach their full potential. Check out our top toys from Barbie, Hot Wheels, ...",3391,104,2
991,Chonqing Rural Bank,3.6,0.8,69.6,5.0,China,Asia,35.86166,104.195397,Chongqing Rural Commercial Bank Co. Ltd. engages in the provision of banking and financial services. It operates through the following segments: Corporate.,5221,105,2
992,Bank of Ireland,8.2,-2.4,195.3,6.0,Ireland,Europe,53.41291,-8.24389,We are committed to keeping your everyday banking secure so you can manage your accounts and payments with confidence.,5221,95,2
993,CA,4.7,0.9,11.6,11.6,USA,North America,37.09024,-95.712891,Find information on how to access disaster relief services and information on ensuring your health and safety.... ... Get COVID-19 Information and Help ... Official ...,5416,103,2
994,TD Ameritrade Holding,2.6,0.6,21.0,11.5,USA,North America,37.09024,-95.712891,"TD Ameritrade, Inc. is now at Charles Schwab. Use your existing account information and log in to explore new account and wealth management opportunities at ...",5231,110,2
995,Adobe Systems,4.4,0.7,10.2,20.6,USA,North America,37.09024,-95.712891,"Adobe is changing the world through digital experiences. We help our customers create, deliver and optimize content and applications.",5112,96,2
996,SÃ¼dzucker,9.3,0.5,10.9,8.6,Germany,Europe,51.165691,10.451526,Südzucker AG · Sugar segment · Special products segment · CropEnergies segment · Starch segment · Fruit segment · Careers · Global and local. At home in over 30 ...,3113,115,2
997,Avnet,25.2,0.5,10.6,5.0,USA,North America,37.09024,-95.712891,"Avnet is a global leader of electronic components and services, guiding makers and manufacturers from design to delivery. Let Avnet help you reach further.",4236,103,2
998,CH Robinson Worldwide,11.4,0.6,2.8,9.6,USA,North America,37.09024,-95.712891,"Reliably meet all your global logistics and technology needs with C.H. Robinson. Supply chain management is optimized with our experience, data, and scale.",4885,105,2
999,Land Securities Group,1.1,0.8,17.3,9.8,UK,Europe,55.378051,-3.435973,Land Securities Group PLC announced its annual results for the twelve months ended 31 March 2024 on Friday 17th May 2024. Find out more. Read our 2024 Annual ...,5311,116,2
1000,Yamada Denki,22.2,0.7,11.2,4.0,Japan,Asia,36.204824,138.252924,家電の事なら「ヤマダデンキ」におまかせ下さい。全都道府県に家電量販店を展開し、量販ならではの安さ、豊富な品揃え、配送ネットワークで暮らしをサポートいたします ...,4431,143,2
1001,Mitsubishi UFJ Lease,8.8,0.4,44.6,4.3,Japan,Asia,36.204824,138.252924,"Mitsubishi HC Capital Inc. will prove worthy of the trust of customers, shareholders and employees as we contribute to realize a more prosperous society.",5331,105,2
1001,Nan Ya Plastics,10.2,0.1,16.3,13.9,Taiwan,Asia,23.69781,120.960515,"Nan Ya Plastics Corporation was founded in 1958. The four main product categories of the company are plastics processing, plastic materials, ...",3261,105,2
1003,NetApp,6.3,0.5,10.9,12.4,USA,North America,37.09024,-95.712891,"Turn a world of disruption into opportunity with intelligent data infrastructure from NetApp. Realize seamless flexibility—any data, any workload, ...",5182,102,2
1004,Chiba Bank,2.4,0.5,132.2,6.0,Japan,Asia,36.204824,138.252924,"IR Topics & News Releases · Sep. 6, 2024. Notice Concerning Commencement of Tender Offer for Shares, Etc., of EDGE Technology Inc. · Sep. 6, 2024. Notice ...",5239,121,2
1005,Abu Dhabi Commercial Bank,2.6,0.7,49.2,6.1,United Arab Emirates,Asia,23.424076,53.847818,"ADCB is a full-service commercial bank offering a range of products and services such as retail banking, loans, cards, wealth management, and Islamic ...",5221,108,2
1006,Johnson Matthey,19.3,0.5,5.2,7.5,UK,Europe,55.378051,-3.435973,"Johnson Matthey is a global leader in sustainable technologies, catalysing the transition to net zero. Our vision is for a world that's cleaner and ...",3251,106,2
1007,Latam Airlines,9.7,0.0,21.0,11.1,Chile,South America,-35.675147,-71.542969,"Find the best travel deals with LATAM. Book flights, hotel reservations and car rentals with latam.com. Redeem airline tickets and more with LATAM Pass ...",4811,109,2
1008,Tingyi Holding,9.2,0.5,7.5,15.0,China,Asia,35.86166,104.195397,"Tingyi (Cayman Islands) Holding Corp. operates as an investment holding company. It operates through the following business segments: Instant Noodles,",3114,106,2
1009,Public Storage,1.8,0.9,8.8,26.7,USA,North America,37.09024,-95.712891,Public Storage offers self-storage units in thousands of facilities near you. Find the right size storage unit for your needs. Reserve at Publicstorage.com ...,5311,104,2
1011,Areva,12.3,-0.1,39.8,6.2,France,Europe,46.227638,2.213749,AREVA NP. AREVA NP is a major international player in the nuclear energy market recognized for its innovative solutions and value-added technologies for ...,2211,103,2
1012,Sun Art Retail Group,12.3,0.4,7.2,13.9,China,Asia,35.86166,104.195397,"Cookies and Privacy Policy. We use cookies to enhance your experience on our Website. By continuing to use this Website, you agree to the use of these cookies.",4451,108,2
1013,Subsea 7,6.3,0.8,10.5,8.3,UK,Europe,55.378051,-3.435973,"Subsea7 S.A. is a subsea engineering, construction and services company serving the offshore energy industry. The company is registered in Luxembourg with ...",2371,107,2
1014,Santos,3.4,0.5,17.7,13.1,Australia,Oceania,-25.274398,133.775136,Our purpose is to provide reliable and affordable energy to help create a better world for everyone. Investors. Read ...,2211,97,2
1015,Bankia,12.2,-24.5,372.6,0.7,Spain,Europe,40.463667,-3.74922,"Desde el pasado 12 de noviembre de 2021, la banca online de Bankia ya no está disponible y CaixaBankNow es tu nueva banca digital. Puedes acceder con las mismas ...",5221,113,2
1016,Land Lease Group,11.9,0.5,12.6,5.8,Australia,Oceania,-25.274398,133.775136,"Lendlease Full Year 2024 Results. Monday 19th August 2024 9.30am AEST via conference call and live webcast. Tony Lombardo, Group Chief Executive Officer and ...",2361,118,2
1017,Norsk Hydro,11.7,-0.2,20.9,9.0,Norway,Europe,60.472024,8.468946,Share price. Norsk Hydro ASA (NHY). 55.50. NOK -1.91%. See all share data · a man ... © 2024 Norsk Hydro ASA. BESbswy.,3314,116,2
1018,Fidelity National Information,5.8,0.5,13.6,11.3,USA,North America,37.09024,-95.712891,"FIS is fintech for bold ideas. FIS is behind the financial technology that transforms how we live, work and play.",5182,101,2
1019,Fosun International,8.2,0.6,26.0,4.1,China,Asia,35.86166,104.195397,"After more than 30 years of development, Fosun has become a global innovation-driven consumer group. Adhering to the mission of creating happier lives for ...",4481,109,2
1019,Sears Holdings,39.9,-1.1,19.3,5.5,USA,North America,37.09024,-95.712891,"Jan 21, 2022 Transformco to Close Sears Store in Ft. · Jul 26, 2021 Transform SR Holding Management LLC Identifies and Addresses Data Security Incident · Jul 1, ...",4481,118,2
1021,Delta Lloyd,14.6,-2.0,105.5,3.3,The Netherlands,Europe,52.132633,5.291266,"Dec 12, 2018 ... Delta Lloyd was the outcome of a merger in 1969 of three insurance companies; De Hollandsche Societeit (1807), Amstleven (1992) and Nedlloyd (1853).",5241,126,2
1022,UC Rusal,11.0,-0.1,25.5,8.1,Russia,Europe,61.52401,105.318756,"We present low carbon aluminum ALLOW, which is designed to reduce the ""carbon footprint"" of downstream production. AluminiumLeader.com.",3314,101,2
1023,Sumitomo Chemical,23.5,0.1,28.1,5.1,Japan,Asia,36.204824,138.252924,"This is the website of Sumitomo Chemical Co., Ltd.. Sumitomo Chemical provides a wide range of products developed by harnessing the Power of Chemistry that ...",3251,110,2
1024,Banca MPS,12.1,-4.1,288.9,3.2,Italy,Europe,41.87194,12.56738,"It is the world's oldest or second oldest bank, depending on the definition, and the fifth largest Italian commercial and retail bank.",5221,101,2
1025,Alleghany,4.8,0.7,22.8,6.4,USA,North America,37.09024,-95.712891,"Corporate Overview ... Alleghany Corporation, a wholly-owned subsidiary of Berkshire Hathaway, owns and supports property and casualty reinsurance and insurance ...",5241,103,2
1026,Hyundai Engineering,11.8,0.5,12.0,6.4,South Korea,Asia,35.907757,127.766922,Official Site Hyundai E&C · Media Hub Newsroom. intro. Official Site Hyundai E&C · Media Hub Newsroom.,2362,99,2
1027,Canadian Tire,11.5,0.5,13.2,5.6,Canada,North America,56.130366,-106.346771,"Get anything from auto parts to home décor, outdoor living products, fitness/sports equipment, tools and more at Canadian Tire online or one of 500+ stores.",4441,107,2
1028,Shanghai International Port,4.5,0.8,13.3,9.8,China,Asia,35.86166,104.195397,"Its headquarters are located in SIPG Cruise City [zh], Hongkou District, Shanghai, but the registered address is located in the Shanghai Free-Trade Zone, Pudong ...",4883,111,2
1029,St Jude Medical,5.5,0.8,9.3,11.9,USA,North America,37.09024,-95.712891,Abbott develops life-changing medical devices for cardiovascular conditions.,3391,85,2
1030,Eiffage,18.0,0.3,33.8,4.1,France,Europe,46.227638,2.213749,"Aug 28, 2024 ... Invent your own future a human perspective. When you join Eiffage, you join a Group where each and every individual is encouraged to surpass ...",2371,113,2
